{
  "locale": "en",
  "name": "Ashwinipriya and Chandra Mohan",
  "location": "Kathmandu, Nepal",
  "quote": "We had seen great healthcare in Sweden and were anxious about finding the same standard abroad. Khan Meditour's coordinators matched us with the right hospital and made the whole journey feel just as reassuring.",
  "image": "https://picsum.photos/seed/ashwini/800/600",
  "video": "https://example.com/video1.mp4",
  "videoDuration": "1:01",
  "brandLabel": "BIRTH"
}
