{
  "locale": "bn",
  "name": "অশ্বিনিপ্রিয়া ও চন্দ্র মোহন",
  "location": "কাঠমান্ডু, নেপাল",
  "quote": "আমরা সুইডেনে দারুণ স্বাস্থ্যসেবা দেখেছিলাম এবং বিদেশে একই মান খুঁজে পেতে উদ্বিগ্ন ছিলাম। খান মেডিট্যুরের কোঅর্ডিনেটররা আমাদের সঠিক হাসপাতালের সাথে মিলিয়ে দিয়েছে এবং পুরো যাত্রাটিকে ঠিক ততটাই নিশ্চিত মনে করিয়েছে।",
  "image": "https://picsum.photos/seed/ashwini/800/600",
  "video": "https://example.com/video1.mp4",
  "videoDuration": "1:01",
  "brandLabel": "সুপারবার্থ"
}
